{"meta":{"version":"3.1","generated":"2025-11-22T16:11:44.816186Z","project":"src"},"files":["config_loader.py","indexer.py","main.py","parser.py","validator.py","__init__.py","builders/builder_comments.py","builders/builder_docstrings.py","builders/builder_location.py","builders/builder_tech_index.py","builders/__init__.py","cli/cli_index.py","cli/cli_location.py","cli/__init__.py","serializers/serializer_base.py","serializers/serializer_json.py","serializers/serializer_msgpack.py","serializers/__init__.py","tests/__init__.py","utils/utils_file.py","utils/utils_hash.py","utils/utils_logger.py","utils/__init__.py","viewers/viewer_index.py","viewers/viewer_static_html.py","viewers/__init__.py"],"modules":[[0,0,1,265],[15,1,1,678],[53,2,1,599],[79,3,1,468],[102,4,1,384],[117,5,1,1],[118,6,1,301],[133,7,1,268],[146,8,1,230],[159,9,1,385],[178,10,1,1],[179,11,1,312],[198,12,1,196],[212,13,1,1],[213,14,1,86],[222,15,1,230],[235,16,1,175],[246,17,1,1],[247,18,1,1],[248,19,1,451],[263,20,1,210],[271,21,1,194],[280,22,1,1],[281,23,1,259],[296,24,1,167],[306,25,1,1]],"classes":[[1,0,27,212],[16,1,27,34],[17,1,38,43],[18,1,47,52],[19,1,56,62],[20,1,66,71],[21,1,75,80],[22,1,84,90],[23,1,94,100],[24,1,103,677],[54,2,38,459],[80,3,28,32],[81,3,36,45],[82,3,49,58],[83,3,62,67],[84,3,71,74],[85,3,78,87],[86,3,90,467],[103,4,24,383],[119,6,26,300],[134,7,25,267],[147,8,25,229],[160,9,27,384],[180,11,27,289],[199,12,23,173],[214,14,20,85],[223,15,25,229],[236,16,23,174],[282,23,24,258],[297,24,26,166]],"functions":[[2,0,58,69],[3,0,71,110],[4,0,112,142],[5,0,144,166],[6,0,168,184],[7,0,186,212],[8,0,219,239],[9,0,242,264],[25,1,110,140],[26,1,142,182],[27,1,184,204],[28,1,206,226],[29,1,228,248],[30,1,250,287],[31,1,289,344],[32,1,346,397],[33,1,399,431],[34,1,433,444],[35,1,446,477],[36,1,479,496],[37,1,498,522],[38,1,524,568],[39,1,570,606],[40,1,608,622],[41,1,624,638],[42,1,640,654],[43,1,656,677],[55,2,45,86],[56,2,88,137],[57,2,139,324],[58,2,326,368],[59,2,370,405],[60,2,407,433],[61,2,436,459],[62,2,463,484],[63,2,487,530],[64,2,533,594],[87,3,97,99],[88,3,101,180],[89,3,182,198],[90,3,200,253],[91,3,255,308],[92,3,310,346],[93,3,348,376],[94,3,378,405],[95,3,407,436],[96,3,438,467],[104,4,35,37],[105,4,39,93],[106,4,95,161],[107,4,163,212],[108,4,214,245],[109,4,247,299],[110,4,301,337],[111,4,339,361],[112,4,363,383],[120,6,41,70],[121,6,72,95],[122,6,97,117],[123,6,119,148],[124,6,150,179],[125,6,181,210],[126,6,212,245],[127,6,247,270],[128,6,272,285],[129,6,287,300],[135,7,40,69],[136,7,71,91],[137,7,93,113],[138,7,115,147],[139,7,149,181],[140,7,183,215],[141,7,217,250],[142,7,252,267],[148,8,40,60],[149,8,62,82],[150,8,84,108],[151,8,110,134],[152,8,136,160],[153,8,162,183],[154,8,185,212],[155,8,214,229],[161,9,43,75],[162,9,77,97],[163,9,99,122],[164,9,124,135],[165,9,137,162],[166,9,164,195],[167,9,197,227],[168,9,229,252],[169,9,254,285],[170,9,287,304],[171,9,306,329],[172,9,331,362],[173,9,364,384],[181,11,34,37],[182,11,39,154],[183,11,156,229],[184,11,231,265],[185,11,267,289],[186,11,292,307],[200,12,30,33],[201,12,35,115],[202,12,117,154],[203,12,156,173],[204,12,176,191],[215,14,27,29],[216,14,32,48],[217,14,51,74],[218,14,76,85],[224,15,35,48],[225,15,50,112],[226,15,114,179],[227,15,181,201],[228,15,203,214],[229,15,216,229],[237,16,31,51],[238,16,53,95],[239,16,97,152],[240,16,154,163],[241,16,165,174],[249,19,30,52],[250,19,55,124],[251,19,127,164],[252,19,167,226],[253,19,229,276],[254,19,279,313],[255,19,316,370],[256,19,373,414],[257,19,417,450],[264,20,23,71],[265,20,74,134],[266,20,137,178],[267,20,181,209],[272,21,22,82],[273,21,85,112],[274,21,115,144],[275,21,147,189],[283,23,31,34],[284,23,36,88],[285,23,90,99],[286,23,101,106],[287,23,108,130],[288,23,132,165],[289,23,167,192],[290,23,194,222],[291,23,224,258],[298,24,34,45],[299,24,47,108],[300,24,110,151],[301,24,153,166]],"imports":[[10,0,19],[11,0,20],[12,0,22],[13,0,12],[14,0,15],[44,1,15],[45,1,16],[46,1,17],[47,1,19],[48,1,20],[49,1,21],[50,1,348],[51,1,349],[52,1,353],[65,2,20],[66,2,21],[67,2,22],[68,2,23],[69,2,24],[70,2,26],[71,2,27],[72,2,28],[73,2,29],[74,2,30],[75,2,31],[76,2,32],[77,2,33],[78,2,445],[97,3,17],[98,3,18],[99,3,19],[100,3,20],[101,3,22],[113,4,16],[114,4,17],[115,4,19],[116,4,202],[130,6,18],[131,6,19],[132,6,21],[143,7,17],[144,7,18],[145,7,20],[156,8,17],[157,8,18],[158,8,20],[174,9,18],[175,9,19],[176,9,20],[177,9,22],[187,11,11],[188,11,12],[189,11,13],[190,11,15],[191,11,16],[192,11,17],[193,11,18],[194,11,19],[195,11,20],[196,11,21],[197,11,22],[205,12,11],[206,12,12],[207,12,13],[208,12,15],[209,12,16],[210,12,17],[211,12,18],[219,14,12],[220,14,13],[221,14,15],[230,15,15],[231,15,16],[232,15,17],[233,15,19],[234,15,20],[242,16,15],[243,16,17],[244,16,18],[245,16,43],[258,19,17],[259,19,18],[260,19,19],[261,19,20],[262,19,22],[268,20,15],[269,20,16],[270,20,18],[276,21,16],[277,21,17],[278,21,18],[279,21,19],[292,23,15],[293,23,16],[294,23,18],[295,23,19],[302,24,17],[303,24,18],[304,24,19],[305,24,21]]}